{
  "schema_version": "1.0",
  "activity": {
    "id": "prefect-run-f6693cda",
    "type": "reconciliation",
    "started_at": "2026-03-10T11:00:00+00:00",
    "ended_at": "2026-03-10T11:00:01+00:00"
  },
  "agents": [
    {
      "type": "software",
      "role": "executed",
      "id": "echolot-reconciler",
      "model": "name-match-v2",
      "config_hash": "sha256:2b3c4d5e6f7a8b9c0d1e2f3a4b5c6d7e8f9a0b1c2d3e4f5a6b7c8d9e0f1a2b3c"
    }
  ],
  "target": { "subject": "urn:uuid:9f8e7d6c-5b4a-4938-8271-6f5e4d3c2b1a" },
  "method": { "name": "no-candidate-found" },
  "validation": { "state": "pending" }
}
