{
  "schema_version": "1.0",
  "activity": {
    "id": "prefect-run-d4471ab8",
    "type": "import",
    "started_at": "2026-02-28T02:00:00+00:00",
    "ended_at": "2026-02-28T02:47:51+00:00",
    "batch_of": "import-batch-2026-02"
  },
  "agents": [
    {
      "type": "software",
      "role": "executed",
      "id": "echolot-importer",
      "model": "edm-ingest-v3",
      "config_hash": "sha256:0f9e8d7c6b5a4f3e2d1c0b9a8f7e6d5c4b3a2f1e0d9c8b7a6f5e4d3c2b1a0f9e"
    },
    { "type": "person", "role": "commissioned", "id": "https://orcid.org/0000-0001-5109-3700" }
  ],
  "target": {
    "subject": "https://demo.echolot.eu/entity/object/5512",
    "statements": [
      "http://purl.org/dc/terms/title",
      "http://purl.org/dc/terms/identifier",
      "http://purl.org/dc/terms/publisher"
    ]
  },
  "method": {
    "name": "edm-record-import",
    "parameters": { "mapping": "edm-to-demo-v3", "strict": true }
  },
  "validation": { "state": "auto_accepted" },
  "sources": [
    { "id": "https://www.europeana.eu/", "snapshot": "2026-01-15", "harvested_at": "2026-02-27T22:00:00+00:00" },
    { "id": "https://demo.echolot.eu/corpus/partner-feed", "snapshot": "rev-991" }
  ],
  "rights": {
    "assertion": "http://rightsstatements.org/vocab/InC/1.0/",
    "basis": "Partner agreement ECCCH-2026-114"
  }
}
