{
  "schema_version": "1.0",
  "activity": {
    "id": "prefect-run-7f3a9c21",
    "type": "reconciliation",
    "started_at": "2026-03-04T09:12:00+00:00",
    "ended_at": "2026-03-04T09:12:04+00:00"
  },
  "agents": [
    {
      "type": "software",
      "role": "executed",
      "id": "echolot-reconciler",
      "model": "name-match-v2",
      "config_hash": "sha256:4f1d2a9b8c7e6d5a4b3c2d1e0f9a8b7c6d5e4f3a2b1c0d9e8f7a6b5c4d3e2f1a"
    }
  ],
  "target": {
    "subject": "https://demo.echolot.eu/entity/person/1",
    "statements": ["http://purl.org/dc/terms/creator"]
  },
  "method": {
    "name": "wikidata-lookup",
    "parameters": { "table": "local-wikidata-standin", "threshold": 0.85 },
    "confidence": 0.93,
    "candidate_rank": 1
  },
  "validation": { "state": "auto_accepted" },
  "sources": [
    { "id": "https://www.wikidata.org/", "snapshot": "2026-02-01", "harvested_at": "2026-02-03T00:00:00+00:00" }
  ]
}
