{
  "schema_version": "1.0",
  "activity": {
    "id": "prefect-run-b21e4477",
    "type": "enrichment",
    "started_at": "2026-03-05T14:00:00+00:00",
    "ended_at": "2026-03-05T14:01:30+00:00"
  },
  "agents": [
    {
      "type": "software",
      "role": "executed",
      "id": "echolot-enricher",
      "model": "biography-extract-v1",
      "config_hash": "sha256:9a8b7c6d5e4f3a2b1c0d9e8f7a6b5c4d3e2f1a0b9c8d7e6f5a4b3c2d1e0f9a8b"
    }
  ],
  "target": {
    "subject": "https://demo.echolot.eu/entity/person/1",
    "statements": [
      "http://purl.org/dc/terms/description",
      "http://purl.org/dc/terms/date"
    ]
  },
  "method": {
    "name": "biography-extraction",
    "parameters": { "max_tokens": 512 },
    "confidence": 0.78
  },
  "validation": { "state": "pending" },
  "sources": [
    { "id": "https://demo.echolot.eu/corpus/museum-catalogue", "snapshot": "rev-4821" }
  ]
}
