{
  "schema_version": "1.0",
  "activity": {
    "id": "prefect-run-a7704deb",
    "type": "enrichment",
    "started_at": "2026-03-11T16:20:00+00:00",
    "ended_at": "2026-03-11T16:25:44+00:00",
    "batch_of": "enrichment-batch-2026-03"
  },
  "agents": [
    {
      "type": "software",
      "role": "executed",
      "id": "echolot-enricher",
      "model": "place-linker-v2",
      "config_hash": "sha256:3c4d5e6f7a8b9c0d1e2f3a4b5c6d7e8f9a0b1c2d3e4f5a6b7c8d9e0f1a2b3c4d"
    },
    { "type": "person", "role": "commissioned", "id": "https://orcid.org/0000-0001-5109-3700" },
    { "type": "person", "role": "validated", "id": "https://orcid.org/0000-0002-1825-0097" }
  ],
  "target": {
    "subject": "https://demo.echolot.eu/entity/place/77",
    "statements": ["http://purl.org/dc/terms/spatial"]
  },
  "method": {
    "name": "gazetteer-link",
    "parameters": { "gazetteer": "local-geonames-standin", "radius_km": 25 },
    "confidence": 0.66,
    "candidate_rank": 2
  },
  "validation": {
    "state": "human_accepted",
    "by": "https://orcid.org/0000-0002-1825-0097",
    "at": "2026-03-11T16:25:40+00:00"
  },
  "rights": { "basis": "CC0 gazetteer extract" }
}
